{
  "$schema": "https://json-schema.org/draft/2020-12/schema",
  "$id": "https://openai.local/compass-builder/outcome-gate-ledger.schema.json",
  "title": "Compass Builder controller-owned outcome-gate ledger v1",
  "type": "object",
  "additionalProperties": false,
  "required": ["schemaVersion", "controller", "runId", "requiredRequirementIds", "requiredAcceptanceIds", "gates"],
  "properties": {
    "schemaVersion": {"const": "compass-builder.outcome-gate-ledger.v1"},
    "controller": {"const": "compass-builder"},
    "runId": {"$ref": "#/$defs/runId"},
    "requiredRequirementIds": {"type": "array", "maxItems": 256, "uniqueItems": true, "items": {"$ref": "#/$defs/requirementId"}},
    "requiredAcceptanceIds": {"type": "array", "maxItems": 256, "uniqueItems": true, "items": {"$ref": "#/$defs/acceptanceId"}},
    "gates": {"type": "array", "minItems": 1, "maxItems": 512, "items": {"$ref": "#/$defs/gate"}}
  },
  "$defs": {
    "nonEmpty": {"type": "string", "minLength": 1, "maxLength": 4096, "pattern": "^(?!\\s)(?![\\s\\S]*\\s$)[\\s\\S]+$"},
    "id": {"type": "string", "minLength": 1, "maxLength": 64, "pattern": "^[a-z0-9][a-z0-9._-]{0,63}$"},
    "runId": {"type": "string", "pattern": "^[a-z][a-z0-9-]{1,31}-[0-9a-f]{16,64}$"},
    "requirementId": {"type": "string", "maxLength": 64, "pattern": "^R[0-9]{3,}$"},
    "acceptanceId": {"type": "string", "maxLength": 64, "pattern": "^A[0-9]{3,}$"},
    "digest": {"type": "string", "pattern": "^sha256:[0-9a-f]{64}$"},
    "timestamp": {"type": "string", "maxLength": 64, "pattern": "^\\d{4}-\\d{2}-\\d{2}T\\d{2}:\\d{2}:\\d{2}(?:\\.\\d+)?(?:Z|[+-]\\d{2}:\\d{2})$", "format": "date-time"},
    "repositoryPath": {"type": "string", "minLength": 1, "maxLength": 512, "pattern": "^(?!\\s)(?![\\s\\S]*\\s$)(?!/)(?![A-Za-z]:)(?!.*\\\\)(?!.*[\\u0000-\\u001f\\u007f:<>|?*])(?!.*\\x22)(?!.*(?:^|/)\\.{1,2}(?:/|$))(?!.*//)(?!.*(?:^|/)[^/]*[. ](?:/|$))(?!.*(?:^|/)(?:[Cc][Oo][Nn]|[Pp][Rr][Nn]|[Aa][Uu][Xx]|[Nn][Uu][Ll]|[Cc][Oo][Mm][1-9]|[Ll][Pp][Tt][1-9])(?:\\.[^/]*)?(?:/|$))[^/]+(?:/[^/]+)*$"},
    "workingDirectory": {"type": "string", "minLength": 1, "maxLength": 512, "pattern": "^(?:\\.|(?!\\s)(?![\\s\\S]*\\s$)(?!/)(?![A-Za-z]:)(?!.*\\\\)(?!.*[\\u0000-\\u001f\\u007f:<>|?*])(?!.*\\x22)(?!.*(?:^|/)\\.{1,2}(?:/|$))(?!.*//)(?!.*(?:^|/)[^/]*[. ](?:/|$))(?!.*(?:^|/)(?:[Cc][Oo][Nn]|[Pp][Rr][Nn]|[Aa][Uu][Xx]|[Nn][Uu][Ll]|[Cc][Oo][Mm][1-9]|[Ll][Pp][Tt][1-9])(?:\\.[^/]*)?(?:/|$))[^/]+(?:/[^/]+)*)$"},
    "gate": {
      "type": "object",
      "additionalProperties": false,
      "required": ["id", "gateScope", "storyId", "observableOutcome", "coveredRequirementIds", "coveredAcceptanceIds", "verificationType", "command", "independentReviewPath", "successMarker", "workingDirectory", "shell", "platform", "environmentDigest", "risk", "validationStrength", "required", "state", "evidenceDigest", "validatedAt", "verificationRunId", "handoffReason"],
      "properties": {
        "id": {"$ref": "#/$defs/id"},
        "gateScope": {"enum": ["story", "root"]},
        "storyId": {"anyOf": [{"$ref": "#/$defs/id"}, {"type": "null"}]},
        "observableOutcome": {"allOf": [{"$ref": "#/$defs/nonEmpty"}, {"maxLength": 2000}]},
        "coveredRequirementIds": {"type": "array", "maxItems": 256, "uniqueItems": true, "items": {"$ref": "#/$defs/requirementId"}},
        "coveredAcceptanceIds": {"type": "array", "maxItems": 256, "uniqueItems": true, "items": {"$ref": "#/$defs/acceptanceId"}},
        "verificationType": {"enum": ["command", "manual-review"]},
        "command": {"anyOf": [{"$ref": "#/$defs/nonEmpty"}, {"type": "null"}]},
        "independentReviewPath": {"anyOf": [{"$ref": "#/$defs/repositoryPath"}, {"type": "null"}]},
        "successMarker": {"allOf": [{"$ref": "#/$defs/nonEmpty"}, {"maxLength": 1024}]},
        "workingDirectory": {"$ref": "#/$defs/workingDirectory"},
        "shell": {"anyOf": [{"allOf": [{"$ref": "#/$defs/nonEmpty"}, {"maxLength": 160}]}, {"type": "null"}]},
        "platform": {"allOf": [{"$ref": "#/$defs/nonEmpty"}, {"maxLength": 160}]},
        "environmentDigest": {"$ref": "#/$defs/digest"},
        "risk": {"enum": ["low", "medium", "high"]},
        "validationStrength": {"enum": ["none", "partial", "decisive"]},
        "required": {"type": "boolean"},
        "state": {"enum": ["pending", "met", "unmet", "blocked", "abandoned"]},
        "evidenceDigest": {"anyOf": [{"$ref": "#/$defs/digest"}, {"type": "null"}]},
        "validatedAt": {"anyOf": [{"$ref": "#/$defs/timestamp"}, {"type": "null"}]},
        "verificationRunId": {"anyOf": [{"$ref": "#/$defs/runId"}, {"type": "null"}]},
        "handoffReason": {"anyOf": [{"allOf": [{"$ref": "#/$defs/nonEmpty"}, {"maxLength": 2000}]}, {"type": "null"}]}
      },
      "allOf": [
        {"if": {"properties": {"gateScope": {"const": "story"}}}, "then": {"properties": {"storyId": {"$ref": "#/$defs/id"}}}},
        {"if": {"properties": {"gateScope": {"const": "root"}}}, "then": {"properties": {"storyId": {"type": "null"}}}},
        {"if": {"properties": {"verificationType": {"const": "command"}}}, "then": {"properties": {"command": {"$ref": "#/$defs/nonEmpty"}, "independentReviewPath": {"type": "null"}, "shell": {"allOf": [{"$ref": "#/$defs/nonEmpty"}, {"maxLength": 160}]}, "successMarker": {"type": "string", "pattern": "^(?:stdout-exact:[\\s\\S]+|artifact-sha256:[0-9a-f]{64})$"}, "validationStrength": {"const": "decisive"}}}},
        {"if": {"properties": {"verificationType": {"const": "manual-review"}}}, "then": {"properties": {"command": {"type": "null"}, "independentReviewPath": {"$ref": "#/$defs/repositoryPath"}, "shell": {"type": "null"}, "successMarker": {"const": "review-decision:approved"}, "validationStrength": {"enum": ["partial", "decisive"]}}}},
        {"if": {"properties": {"state": {"enum": ["pending", "abandoned"]}}}, "then": {"properties": {"evidenceDigest": {"type": "null"}, "validatedAt": {"type": "null"}, "verificationRunId": {"type": "null"}}}},
        {"if": {"properties": {"state": {"enum": ["met", "unmet"]}}}, "then": {"properties": {"evidenceDigest": {"$ref": "#/$defs/digest"}, "validatedAt": {"$ref": "#/$defs/timestamp"}, "verificationRunId": {"$ref": "#/$defs/runId"}, "handoffReason": {"type": "null"}}}},
        {"if": {"properties": {"state": {"const": "blocked"}}}, "then": {"oneOf": [{"properties": {"evidenceDigest": {"type": "null"}, "validatedAt": {"type": "null"}, "verificationRunId": {"type": "null"}}}, {"properties": {"evidenceDigest": {"$ref": "#/$defs/digest"}, "validatedAt": {"$ref": "#/$defs/timestamp"}, "verificationRunId": {"$ref": "#/$defs/runId"}}}]}},
        {"if": {"properties": {"state": {"enum": ["pending", "met", "unmet"]}}}, "then": {"properties": {"handoffReason": {"type": "null"}}}},
        {"if": {"properties": {"required": {"const": true}, "state": {"enum": ["blocked", "abandoned"]}}}, "then": {"properties": {"handoffReason": {"allOf": [{"$ref": "#/$defs/nonEmpty"}, {"maxLength": 2000}]}}}}
      ]
    }
  }
}
