{"controller":"compass-builder","gates":[{"command":"python -m unittest tests.test_builder_outcome_gates -v","coveredAcceptanceIds":["A020"],"coveredRequirementIds":["R031"],"environmentDigest":"sha256:1111111111111111111111111111111111111111111111111111111111111111","evidenceDigest":"sha256:2222222222222222222222222222222222222222222222222222222222222222","gateScope":"story","handoffReason":null,"id":"story-contract-tests","independentReviewPath":null,"observableOutcome":"The outcome-gate contract tests pass against the immutable story result.","platform":"windows-amd64","required":true,"risk":"high","shell":"python-3.14","state":"met","storyId":"d1-outcome-gates","successMarker":"stdout-exact:OK","validatedAt":"2026-09-02T18:00:00Z","validationStrength":"decisive","verificationRunId":"cb-20260902-fedcba9876543210","verificationType":"command","workingDirectory":"."},{"command":null,"coveredAcceptanceIds":["A019"],"coveredRequirementIds":["R030"],"environmentDigest":"sha256:3333333333333333333333333333333333333333333333333333333333333333","evidenceDigest":null,"gateScope":"root","handoffReason":null,"id":"root-independent-review","independentReviewPath":"docs/reviews/root-outcome.md","observableOutcome":"An independent reviewer confirms the integrated root outcome matches its acceptance contract.","platform":"windows-amd64","required":true,"risk":"high","shell":null,"state":"pending","storyId":null,"successMarker":"review-decision:approved","validatedAt":null,"validationStrength":"decisive","verificationRunId":null,"verificationType":"manual-review","workingDirectory":"."},{"command":"python -m unittest discover -s tests -v","coveredAcceptanceIds":["A018"],"coveredRequirementIds":["R029"],"environmentDigest":"sha256:4444444444444444444444444444444444444444444444444444444444444444","evidenceDigest":null,"gateScope":"root","handoffReason":"The required dependency is unavailable; hand off to the repository owner before retrying.","id":"root-regression-suite","independentReviewPath":null,"observableOutcome":"The repository regression suite passes after serial integration.","platform":"windows-amd64","required":true,"risk":"medium","shell":"python-3.14","state":"blocked","storyId":null,"successMarker":"artifact-sha256:5555555555555555555555555555555555555555555555555555555555555555","validatedAt":null,"validationStrength":"decisive","verificationRunId":null,"verificationType":"command","workingDirectory":"."}],"requiredAcceptanceIds":["A018","A019","A020"],"requiredRequirementIds":["R029","R030","R031"],"runId":"cb-20260902-fedcba9876543210","schemaVersion":"compass-builder.outcome-gate-ledger.v1"}
